{
  "generated_at": "2026-03-05T02:02:02.590Z",
  "root": "",
  "scope_paths": [
    "app",
    "renderer",
    "main",
    "brain",
    "scripts",
    "data/input/shared",
    "tests",
    "to-do/agents",
    "to-do/skills"
  ],
  "excluded_paths": [
    "node_modules",
    "dist",
    "native/dx12/build",
    "native/dx12/build-mingw"
  ],
  "totals": {
    "files_scoped": 336,
    "features_total": 25,
    "subsystems_total": 7
  },
  "subsystem_counts": {
    "App shell/UI": 59,
    "Brain modules/wrappers/math": 54,
    "Data catalogs/contracts": 24,
    "Main process/IPC/services": 63,
    "Pipeline/gates/release scripts": 25,
    "Test suite": 34,
    "Governance/agents/skills": 77
  },
  "feature_entries": [
    {
      "feature_id": "feature_app_legacy_shell",
      "feature_name": "Legacy app shell UI",
      "user_value": "Maintains legacy shell compatibility and app chrome behavior.",
      "entrypoints": [
        "window",
        "main"
      ],
      "owner_files": [
        "app/index.html",
        "app/logs.html",
        "app/logs.js",
        "app/renderer.js",
        "app/styles.css"
      ],
      "runtime_dependencies": [],
      "ipc_channels": [],
      "storage_keys/files": [],
      "commands": [],
      "tests_covering": [],
      "status": "active",
      "risk_notes": [
        "No direct tests mapped; documented as uncovered risk."
      ],
      "primary_subsystem": "App shell/UI"
    },
    {
      "feature_id": "feature_renderer_boot_lifecycle",
      "feature_name": "Renderer lifecycle bootstrap",
      "user_value": "Deterministic app/page/control load order across renderer windows.",
      "entrypoints": [
        "window",
        "page",
        "control"
      ],
      "owner_files": [
        "renderer/boot/app_bootstrap.js",
        "renderer/boot/app_post_load.js",
        "renderer/boot/app_pre_load.js",
        "renderer/boot/legacy_module_loader.js",
        "renderer/boot/legacy_module_manifest.js",
        "renderer/boot/specs/app_hook_specs.js",
        "renderer/boot/specs/control_hook_specs.js",
        "renderer/boot/specs/hook_binding_specs.js",
        "renderer/boot/specs/page_hook_specs.js"
      ],
      "runtime_dependencies": [],
      "ipc_channels": [],
      "storage_keys/files": [],
      "commands": [],
      "tests_covering": [],
      "status": "active",
      "risk_notes": [
        "No direct tests mapped; documented as uncovered risk."
      ],
      "primary_subsystem": "App shell/UI"
    },
    {
      "feature_id": "feature_renderer_window_shells",
      "feature_name": "Renderer window shells",
      "user_value": "Main/log window host shells and view wiring.",
      "entrypoints": [
        "window"
      ],
      "owner_files": [
        "renderer/views/logs_window.html",
        "renderer/views/main_window.html",
        "renderer/windows/logs_window/legacy_logs_bridge.js",
        "renderer/windows/logs_window/window_post_load.js",
        "renderer/windows/logs_window/window_pre_load.js",
        "renderer/windows/logs_window/window_shell.js",
        "renderer/windows/main_window/legacy_renderer_bridge.js",
        "renderer/windows/main_window/window_post_load.js",
        "renderer/windows/main_window/window_pre_load.js",
        "renderer/windows/main_window/window_shell.js"
      ],
      "runtime_dependencies": [],
      "ipc_channels": [],
      "storage_keys/files": [],
      "commands": [],
      "tests_covering": [],
      "status": "active",
      "risk_notes": [
        "No direct tests mapped; documented as uncovered risk."
      ],
      "primary_subsystem": "App shell/UI"
    },
    {
      "feature_id": "feature_renderer_core_runtime",
      "feature_name": "Renderer core runtime registries",
      "user_value": "Centralized constants, registries, and DOM dictionaries for renderer behavior.",
      "entrypoints": [
        "page",
        "control"
      ],
      "owner_files": [
        "renderer/core/alias_index.js",
        "renderer/core/constants.js",
        "renderer/core/dom_registry.js",
        "renderer/core/load_hook_registry.js",
        "renderer/core/page_registry.js",
        "renderer/core/pattern_registry.js",
        "renderer/core/runtime_registry.js",
        "renderer/core/text_dictionary.js",
        "renderer/styles/app.css"
      ],
      "runtime_dependencies": [],
      "ipc_channels": [],
      "storage_keys/files": [],
      "commands": [],
      "tests_covering": [],
      "status": "active",
      "risk_notes": [
        "No direct tests mapped; documented as uncovered risk."
      ],
      "primary_subsystem": "App shell/UI"
    },
    {
      "feature_id": "feature_renderer_control_plane",
      "feature_name": "Renderer control modules",
      "user_value": "Command palette, graph, tree, and universe controls.",
      "entrypoints": [
        "control"
      ],
      "owner_files": [
        "renderer/controls/command_palette_control/control_controller.js",
        "renderer/controls/command_palette_control/control_post_load.js",
        "renderer/controls/command_palette_control/control_pre_load.js",
        "renderer/controls/graph_control/control_controller.js",
        "renderer/controls/graph_control/control_post_load.js",
        "renderer/controls/graph_control/control_pre_load.js",
        "renderer/controls/tree_control/control_controller.js",
        "renderer/controls/tree_control/control_post_load.js",
        "renderer/controls/tree_control/control_pre_load.js",
        "renderer/controls/universe_canvas_control/control_controller.js",
        "renderer/controls/universe_canvas_control/control_post_load.js",
        "renderer/controls/universe_canvas_control/control_pre_load.js"
      ],
      "runtime_dependencies": [],
      "ipc_channels": [],
      "storage_keys/files": [],
      "commands": [],
      "tests_covering": [],
      "status": "active",
      "risk_notes": [
        "No direct tests mapped; documented as uncovered risk."
      ],
      "primary_subsystem": "App shell/UI"
    },
    {
      "feature_id": "feature_renderer_page_plane",
      "feature_name": "Renderer page modules",
      "user_value": "Workbench, sentence graph, statistics, and universe page lifecycle logic.",
      "entrypoints": [
        "page"
      ],
      "owner_files": [
        "renderer/pages/sentence_graph_page/page_controller.js",
        "renderer/pages/sentence_graph_page/page_post_load.js",
        "renderer/pages/sentence_graph_page/page_pre_load.js",
        "renderer/pages/statistics_page/page_controller.js",
        "renderer/pages/statistics_page/page_post_load.js",
        "renderer/pages/statistics_page/page_pre_load.js",
        "renderer/pages/universe_page/page_controller.js",
        "renderer/pages/universe_page/page_post_load.js",
        "renderer/pages/universe_page/page_pre_load.js",
        "renderer/pages/workbench_page/page_controller.js",
        "renderer/pages/workbench_page/page_post_load.js",
        "renderer/pages/workbench_page/page_pre_load.js"
      ],
      "runtime_dependencies": [],
      "ipc_channels": [],
      "storage_keys/files": [],
      "commands": [],
      "tests_covering": [],
      "status": "active",
      "risk_notes": [
        "No direct tests mapped; documented as uncovered risk."
      ],
      "primary_subsystem": "App shell/UI"
    },
    {
      "feature_id": "feature_renderer_workers",
      "feature_name": "Renderer workers",
      "user_value": "Background worker execution for heavy renderer computations.",
      "entrypoints": [
        "page"
      ],
      "owner_files": [
        "renderer/workers/stats_worker.js",
        "renderer/workers/word_universe_worker.js"
      ],
      "runtime_dependencies": [],
      "ipc_channels": [],
      "storage_keys/files": [],
      "commands": [],
      "tests_covering": [],
      "status": "active",
      "risk_notes": [
        "No direct tests mapped; documented as uncovered risk."
      ],
      "primary_subsystem": "App shell/UI"
    },
    {
      "feature_id": "feature_main_boot_lifecycle",
      "feature_name": "Main process boot lifecycle",
      "user_value": "Ensures pre-load/post-load and app boot orchestration is deterministic.",
      "entrypoints": [
        "main",
        "window"
      ],
      "owner_files": [
        "main/boot/app_boot_runtime.js",
        "main/boot/app_boot_specs.js",
        "main/boot/app_bootstrap.js",
        "main/boot/app_hook_shared.js",
        "main/boot/app_post_load.js",
        "main/boot/app_pre_load.js"
      ],
      "runtime_dependencies": [],
      "ipc_channels": [],
      "storage_keys/files": [],
      "commands": [],
      "tests_covering": [],
      "status": "active",
      "risk_notes": [
        "No direct tests mapped; documented as uncovered risk."
      ],
      "primary_subsystem": "Main process/IPC/services"
    },
    {
      "feature_id": "feature_main_data_repositories",
      "feature_name": "Main data repository layer",
      "user_value": "Persistent state, migration, and domain repository management.",
      "entrypoints": [
        "main",
        "service"
      ],
      "owner_files": [
        "main/data-io.js",
        "main/data/data_hook_shared.js",
        "main/data/data_migrate_specs.js",
        "main/data/data_migrate_v0_to_v1.js",
        "main/data/data_post_load.js",
        "main/data/data_pre_load.js",
        "main/data/repository_auth.js",
        "main/data/repository_diagnostics.js",
        "main/data/repository_language_bridge.js",
        "main/data/repository_manifest.js",
        "main/data/repository_raw_storage.js",
        "main/data/repository_registry.js",
        "main/data/repository_shared.js",
        "main/data/repository_specs.js",
        "main/data/repository_state.js",
        "main/data/repository_ui_preferences.js",
        "main/data/repository_universe.js"
      ],
      "runtime_dependencies": [
        "main/data/*",
        "data/input/shared/main/*"